Id,Title,Labels,Iteration,Iteration Start,Iteration End,Type,Estimate,Current State,Created at,Accepted at,Deadline,Requested By,Description,URL,Owned By
75777092,Given I'm on the homepaged and not logged in When I visit the site I see a splash page with banner and quotes,"",1,"Jul 21, 2014","Jul 27, 2014",feature,2,unstarted,"Jul 27, 2014",,,Jeff Taggart,,https://www.pivotaltracker.com/story/show/75777092,
75777366,"Given I'm on the homepage When I click on ""JOIN"" Then I see a registration page","",1,"Jul 21, 2014","Jul 27, 2014",feature,1,unstarted,"Jul 27, 2014",,,Jeff Taggart,,https://www.pivotaltracker.com/story/show/75777366,
75777410,"Given I'm on the registration page When I fill it out entirely and click ""Register"" Then I'm informed that I registered","",1,"Jul 21, 2014","Jul 27, 2014",feature,2,unstarted,"Jul 27, 2014",,,Jeff Taggart,,https://www.pivotaltracker.com/story/show/75777410,
75777090,"Given I'm registered When I fill out the Login form and click ""Login"" Then I'm logged in","",1,"Jul 21, 2014","Jul 27, 2014",feature,1,unstarted,"Jul 27, 2014",,,Jeff Taggart,"To start, I only see my first and last name",https://www.pivotaltracker.com/story/show/75777090,
75777754,"Given I'm logged in When I click ""Logout"" Then I'm Logged out","",1,"Jul 21, 2014","Jul 27, 2014",feature,1,unstarted,"Jul 27, 2014",,,Jeff Taggart,,https://www.pivotaltracker.com/story/show/75777754,
75777784,Given I've logged in When I click on my name Then I can edit my profile,"",1,"Jul 21, 2014","Jul 27, 2014",feature,2,unstarted,"Jul 27, 2014",,,Jeff Taggart,Same view as the register page. Pre-filled with my previous answers. Same registration validations apply.,https://www.pivotaltracker.com/story/show/75777784,
75777548,Given I'm registered When I log in Then I see a place to post my rant,"",1,"Jul 21, 2014","Jul 27, 2014",feature,1,unstarted,"Jul 27, 2014",,,Jeff Taggart,,https://www.pivotaltracker.com/story/show/75777548,
75777562,"When I fill out the rant form Then my rant is posted under ""My Rants""","",2,"Jul 28, 2014","Aug 3, 2014",feature,2,unstarted,"Jul 27, 2014",,,Jeff Taggart,,https://www.pivotaltracker.com/story/show/75777562,
75777820,Given I've created a rant When I click delete Then it deletes the rant,"",2,"Jul 28, 2014","Aug 3, 2014",feature,1,unstarted,"Jul 27, 2014",,,Jeff Taggart,,https://www.pivotaltracker.com/story/show/75777820,
75777572,"Given another user has posted a rant When I go to my homepage Then I see it under ""Latest Rants""","",2,"Jul 28, 2014","Aug 3, 2014",feature,1,unstarted,"Jul 27, 2014",,,Jeff Taggart,,https://www.pivotaltracker.com/story/show/75777572,
75777610,"Given there is another user When I click follow on the user from the homepage Then I can view that user under the ""Following"" page","",2,"Jul 28, 2014","Aug 3, 2014",feature,2,unstarted,"Jul 27, 2014",,,Jeff Taggart,,https://www.pivotaltracker.com/story/show/75777610,
75777728,"Given I've followed a user and I'm viewing one of their rants on the homepage When I click ""Unfollow"" Then the user no longer shows up on the ""Following"" page","",2,"Jul 28, 2014","Aug 3, 2014",feature,2,unstarted,"Jul 27, 2014",,,Jeff Taggart,,https://www.pivotaltracker.com/story/show/75777728,
75778560,"Given I'm on the ""Following"" page When I click ""Unfollow"" Then I no longer follow that user","",2,"Jul 28, 2014","Aug 3, 2014",feature,1,unstarted,"Jul 27, 2014",,,Jeff Taggart,,https://www.pivotaltracker.com/story/show/75778560,
75777596,Given there is a rant by another user When I click on the body of the rant Then I'm taken to view the rant,"",3,"Aug 4, 2014","Aug 10, 2014",feature,2,unstarted,"Jul 27, 2014",,,Jeff Taggart,,https://www.pivotaltracker.com/story/show/75777596,
75777696,Given I'm on the homepage and I'm viewing a rant When I click on a user's name Then I see their profile,"",3,"Aug 4, 2014","Aug 10, 2014",feature,2,unstarted,"Jul 27, 2014",,,Jeff Taggart,"To start, I just see their bio
",https://www.pivotaltracker.com/story/show/75777696,
75778598,Given I'm viewing a specific rant When I click on the user's name Then I see their profile,"",3,"Aug 4, 2014","Aug 10, 2014",feature,1,unstarted,"Jul 27, 2014",,,Jeff Taggart,,https://www.pivotaltracker.com/story/show/75778598,
75778036,When I click to view a user's profile Then I can see all of their rants,"",3,"Aug 4, 2014","Aug 10, 2014",feature,2,unstarted,"Jul 27, 2014",,,Jeff Taggart,,https://www.pivotaltracker.com/story/show/75778036,
75777702,"Given I'm on a user's profile page When I click ""follow"" Then that user shows up on the ""Following"" page","",3,"Aug 4, 2014","Aug 10, 2014",feature,1,unstarted,"Jul 27, 2014",,,Jeff Taggart,,https://www.pivotaltracker.com/story/show/75777702,
75777740,"Given I've followed a user and I'm viewing their profile When I click ""Unfollow"" Then the user no longer shows up on the ""Following"" page","",3,"Aug 4, 2014","Aug 10, 2014",feature,1,unstarted,"Jul 27, 2014",,,Jeff Taggart,,https://www.pivotaltracker.com/story/show/75777740,
75777578,When I've filled our an incomplete registration form Then I am shown a form with errors,"",4,"Aug 11, 2014","Aug 17, 2014",feature,3,unstarted,"Jul 27, 2014",,,Jeff Taggart,"All fields are required.

Username must be unique
Password must be 8 characters",https://www.pivotaltracker.com/story/show/75777578,
75777586,When I fill out the rant form incorrectly Then I see errors,"",4,"Aug 11, 2014","Aug 17, 2014",feature,2,unstarted,"Jul 27, 2014",,,Jeff Taggart,"Both title and body required.

Title must be less than 50 characters
Body must be greater than 160 characters",https://www.pivotaltracker.com/story/show/75777586,
75778534,When I fill in the Login form incorrectly Then I see a general message telling me it failed,"",4,"Aug 11, 2014","Aug 17, 2014",feature,2,unstarted,"Jul 27, 2014",,,Jeff Taggart,"Username is required
Password is required

If username and password don't match, then I see a message saying ""Login failed""",https://www.pivotaltracker.com/story/show/75778534,
75777118,"As an anonymous user, Given that I've never registered and seen the homepage before when I revisit the homepage then I see a ""Welcome back"" message","",4,"Aug 11, 2014","Aug 17, 2014",feature,2,unstarted,"Jul 27, 2014",,,Jeff Taggart,,https://www.pivotaltracker.com/story/show/75777118,
75777888,"Given I'm viewing a specific rant When I click ""Favorite"" Then that rant becomes favorited","",4,"Aug 11, 2014","Aug 17, 2014",feature,1,unstarted,"Jul 27, 2014",,,Jeff Taggart,,https://www.pivotaltracker.com/story/show/75777888,
75778064,When I view a user's profile Then their rants are ordered by most favorites,"",4,"Aug 11, 2014","Aug 17, 2014",feature,2,unstarted,"Jul 27, 2014",,,Jeff Taggart,,https://www.pivotaltracker.com/story/show/75778064,
75777636,When I search by last name Then I see all rants by users with that exact last name,"",5,"Aug 18, 2014","Aug 24, 2014",feature,3,unstarted,"Jul 27, 2014",,,Jeff Taggart,,https://www.pivotaltracker.com/story/show/75777636,
74180980,Exercise Goal,"",5,"Aug 18, 2014","Aug 24, 2014",release,,unstarted,"Jun 30, 2014",,,Jeff Taggart,,https://www.pivotaltracker.com/story/show/74180980,
75777616,"Given I'm viewing my homepage When I click favorite on a rant Then I can see that rant on my ""Favorites"" page","",5,"Aug 18, 2014","Aug 24, 2014",feature,2,unstarted,"Jul 27, 2014",,,Jeff Taggart,,https://www.pivotaltracker.com/story/show/75777616,
75777874,"Given I've favorited a rant When I click ""Unfavorite"" Then it unfavorites that rant","",5,"Aug 18, 2014","Aug 24, 2014",feature,2,unstarted,"Jul 27, 2014",,,Jeff Taggart,Make sure you check the mockups for all the places this can show up!,https://www.pivotaltracker.com/story/show/75777874,
75777612,Given I'm viewing a rant When I click favorite Then it favorites that rant,"",5,"Aug 18, 2014","Aug 24, 2014",feature,1,unstarted,"Jul 27, 2014",,,Jeff Taggart,,https://www.pivotaltracker.com/story/show/75777612,
75777640,When I search by first name Then I see all rants by that first name,"",6,"Aug 25, 2014","Aug 31, 2014",feature,3,unstarted,"Jul 27, 2014",,,Jeff Taggart,,https://www.pivotaltracker.com/story/show/75777640,
75777648,When I search by username Then I see all rants by that username,"",6,"Aug 25, 2014","Aug 31, 2014",feature,1,unstarted,"Jul 27, 2014",,,Jeff Taggart,,https://www.pivotaltracker.com/story/show/75777648,
74182490,Extended Goal,"",6,"Aug 25, 2014","Aug 31, 2014",release,,unstarted,"Jun 30, 2014",,,Jeff Taggart,,https://www.pivotaltracker.com/story/show/74182490,
75777684,Given I'm on the registration page When I upload an image to the form Then I see my image wherever my name shows up,"",6,"Aug 25, 2014","Aug 31, 2014",feature,3,unstarted,"Jul 27, 2014",,,Jeff Taggart,This is a required field!,https://www.pivotaltracker.com/story/show/75777684,
75777682,Given I'm on the edit profile page When I add a profile image and save Then I see that image anywhere my name shows up,"",6,"Aug 25, 2014","Aug 31, 2014",feature,2,unstarted,"Jul 27, 2014",,,Jeff Taggart,,https://www.pivotaltracker.com/story/show/75777682,
75777660,When I search by a certain piece of text Then I see all rants that have a title that contains that text,"",6,"Aug 25, 2014","Aug 31, 2014",feature,3,unstarted,"Jul 27, 2014",,,Jeff Taggart,,https://www.pivotaltracker.com/story/show/75777660,
75777664,When I search by a bit of text Then I see all rants whose body's contain that bit of text,"",7,"Sep 1, 2014","Sep 7, 2014",feature,3,unstarted,"Jul 27, 2014",,,Jeff Taggart,,https://www.pivotaltracker.com/story/show/75777664,
75777706,When I'm filling out a rant and I use Markdown Then I see that markdown rendered for my rant,"",7,"Sep 1, 2014","Sep 7, 2014",feature,3,unstarted,"Jul 27, 2014",,,Jeff Taggart,,https://www.pivotaltracker.com/story/show/75777706,
74634250,Life Goal,"",7,"Sep 1, 2014","Sep 7, 2014",release,,unstarted,"Jul 8, 2014",,,Jeff Taggart,,https://www.pivotaltracker.com/story/show/74634250,
